,Released,Genre,Length,Rating,Country,Language,Director,Writers,Actors,Rewards,Imdb_Rating,Imdb_Votes,imdb_ID,Movie_Budget,Gross_in_US,World_gross_income,Opening_US_CANADA
The Shawshank Redemption,1994-10-14,Drama,142,R,United States,English,Frank Darabont,"Stephen King, Frank Darabont","Tim Robbins, Morgan Freeman, Bob Gunton",Nominated for 7 Oscars. 21 wins & 42 nominations total,9.3,2851631,tt0111161,25000000 ,28767189,28884716,727327
The Godfather,1972-03-24,"Crime, Drama",175,R,United States,"English, Italian, Latin",Francis Ford Coppola,"Mario Puzo, Francis Ford Coppola","Marlon Brando, Al Pacino, James Caan",Won 3 Oscars. 31 wins & 31 nominations total,9.2,1988710,tt0068646,6000000 ,136381073,250341816,302393
The Dark Knight,2008-07-18,"Action, Crime, Drama",152,PG-13,"United States, United Kingdom","English, Mandarin",Christopher Nolan,"Jonathan Nolan, Christopher Nolan, David S. Goyer","Christian Bale, Heath Ledger, Aaron Eckhart",Won 2 Oscars. 162 wins & 164 nominations total,9.0,2835809,tt0468569,185000000 ,534987076,1029266147,158411483
The Godfather Part II,1974-12-18,"Crime, Drama",202,R,United States,"English, Italian, Spanish, Latin, Sicilian",Francis Ford Coppola,"Francis Ford Coppola, Mario Puzo","Al Pacino, Robert De Niro, Robert Duvall",Won 6 Oscars. 17 wins & 21 nominations total,9.0,1349735,tt0071562,13000000 ,47834595,47961919,171417
12 Angry Men,1957-04-10,"Crime, Drama",96,Approved,United States,English,Sidney Lumet,Reginald Rose,"Henry Fonda, Lee J. Cobb, Martin Balsam",Nominated for 3 Oscars. 16 wins & 12 nominations total,9.0,851716,tt0050083,350000 ,955,0,0
Schindler's List,1994-02-04,"Biography, Drama, History",195,R,United States,"English, Hebrew, German, Polish, Latin",Steven Spielberg,"Thomas Keneally, Steven Zaillian","Liam Neeson, Ralph Fiennes, Ben Kingsley",Won 7 Oscars. 91 wins & 49 nominations total,9.0,1434327,tt0108052,22000000 ,96898818,322161245,656636
The Lord of the Rings: The Return of the King,2003-12-17,"Action, Adventure, Drama",201,PG-13,"New Zealand, United States","English, Quenya, Old English, Sindarin",Peter Jackson,"J.R.R. Tolkien, Fran Walsh, Philippa Boyens","Elijah Wood, Viggo Mortensen, Ian McKellen",Won 11 Oscars. 215 wins & 124 nominations total,9.0,1955374,tt0167260,94000000 ,379427292,1156194180,72629713
Pulp Fiction,1994-10-14,"Crime, Drama",154,R,United States,"English, Spanish, French",Quentin Tarantino,"Quentin Tarantino, Roger Avary","John Travolta, Uma Thurman, Samuel L. Jackson",Won 1 Oscar. 69 wins & 72 nominations total,8.9,2191582,tt0110912,8000000 ,107928762,213928762,9311882
The Lord of the Rings: The Fellowship of the Ring,2001-12-19,"Action, Adventure, Drama",178,PG-13,"New Zealand, United States","English, Sindarin",Peter Jackson,"J.R.R. Tolkien, Fran Walsh, Philippa Boyens","Elijah Wood, Ian McKellen, Orlando Bloom",Won 4 Oscars. 125 wins & 127 nominations total,8.9,1983238,tt0120737,93000000 ,316115420,883407846,47211490
"The Good, the Bad and the Ugly",1967-12-29,"Adventure, Western",178,Approved,"Italy, Spain, West Germany",Italian,Sergio Leone,"Luciano Vincenzoni, Sergio Leone, Agenore Incrocci","Clint Eastwood, Eli Wallach, Lee Van Cleef",2 wins & 5 nominations,8.8,802961,tt0060196,1200000 ,25100000,0,25253887
Forrest Gump,1994-07-06,"Drama, Romance",142,PG-13,United States,English,Robert Zemeckis,"Winston Groom, Eric Roth","Tom Hanks, Robin Wright, Gary Sinise",Won 6 Oscars. 50 wins & 74 nominations total,8.8,2228850,tt0109830,55000000 ,330455270,678226465,24450602
The Lord of the Rings: The Two Towers,2002-12-18,"Action, Adventure, Drama",179,PG-13,"New Zealand, United States","English, Sindarin, Old English",Peter Jackson,"J.R.R. Tolkien, Fran Walsh, Philippa Boyens","Elijah Wood, Ian McKellen, Viggo Mortensen",Won 2 Oscars. 132 wins & 138 nominations total,8.8,1763973,tt0167261,94000000 ,342952511,948945489,62007528
Fight Club,1999-10-15,Drama,139,R,"Germany, United States",English,David Fincher,"Chuck Palahniuk, Jim Uhls","Brad Pitt, Edward Norton, Meat Loaf",Nominated for 1 Oscar. 12 wins & 38 nominations total,8.8,2287043,tt0137523,63000000 ,37030102,101209702,11035485
Inception,2010-07-16,"Action, Adventure, Sci-Fi",148,PG-13,"United States, United Kingdom","English, Japanese, French",Christopher Nolan,Christopher Nolan,"Leonardo DiCaprio, Joseph Gordon-Levitt, Elliot Page",Won 4 Oscars. 159 wins & 220 nominations total,8.8,2517914,tt1375666,160000000 ,292587330,839030630,62785337
Star Wars: Episode V - The Empire Strikes Back,1980-06-18,"Action, Adventure, Fantasy",124,PG,United States,English,Irvin Kershner,"Leigh Brackett, Lawrence Kasdan, George Lucas","Mark Hamill, Harrison Ford, Carrie Fisher",Won 1 Oscar. 26 wins & 20 nominations total,8.7,1365441,tt0080684,18000000 ,292753960,538375067,4910483
The Matrix,1999-03-31,"Action, Sci-Fi",136,R,"United States, Australia",English,"Lana Wachowski, Lilly Wachowski","Lilly Wachowski, Lana Wachowski","Keanu Reeves, Laurence Fishburne, Carrie-Anne Moss",Won 4 Oscars. 42 wins & 52 nominations total,8.7,2026128,tt0133093,63000000 ,172076928,467222728,27788331
Goodfellas,1990-09-21,"Biography, Crime, Drama",145,R,United States,"English, Italian",Martin Scorsese,"Nicholas Pileggi, Martin Scorsese","Robert De Niro, Ray Liotta, Joe Pesci",Won 1 Oscar. 44 wins & 38 nominations total,8.7,1242337,tt0099685,25000000 ,46909721,47036784,6368901
One Flew Over the Cuckoo's Nest,1975-11-19,Drama,133,R,United States,English,Milos Forman,"Lawrence Hauben, Bo Goldman, Ken Kesey","Jack Nicholson, Louise Fletcher, Michael Berryman",Won 5 Oscars. 38 wins & 15 nominations total,8.7,1060833,tt0073486,3000000 ,108981275,0,109114817
Se7en,1995-09-22,"Crime, Drama, Mystery",127,R,United States,English,David Fincher,Andrew Kevin Walker,"Morgan Freeman, Brad Pitt, Kevin Spacey",Nominated for 1 Oscar. 29 wins & 43 nominations total,8.6,1774300,tt0114369,33000000 ,100125643,327333559,13949807
It's a Wonderful Life,1947-01-07,"Drama, Family, Fantasy",130,PG,United States,"English, French",Frank Capra,"Frances Goodrich, Albert Hackett, Frank Capra","James Stewart, Donna Reed, Lionel Barrymore",Nominated for 5 Oscars. 7 wins & 6 nominations total,8.6,495169,tt0038650,3180000 ,1483643,9740308,44000
Interstellar,2014-11-07,"Adventure, Drama, Sci-Fi",169,PG-13,"United States, United Kingdom, Canada",English,Christopher Nolan,"Jonathan Nolan, Christopher Nolan","Matthew McConaughey, Anne Hathaway, Jessica Chastain",Won 1 Oscar. 44 wins & 148 nominations total,8.7,2053873,tt0816692,165000000 ,188020017,731079637,47510360
Seven Samurai,1956-11-19,"Action, Drama",207,Not Rated,Japan,Japanese,Akira Kurosawa,"Akira Kurosawa, Shinobu Hashimoto, Hideo Oguni","Toshirô Mifune, Takashi Shimura, Keiko Tsushima",Nominated for 2 Oscars. 5 wins & 9 nominations total,8.6,363557,tt0047478,318649,15942,0,346258
The Silence of the Lambs,1991-02-14,"Crime, Drama, Thriller",118,R,United States,"English, Latin",Jonathan Demme,"Thomas Harris, Ted Tally","Jodie Foster, Anthony Hopkins, Scott Glenn",Won 5 Oscars. 70 wins & 50 nominations total,8.6,1529827,tt0102926,19000000 ,130742922,272742922,13766814
Saving Private Ryan,1998-07-24,"Drama, War",169,R,United States,"English, French, German, Czech",Steven Spielberg,Robert Rodat,"Tom Hanks, Matt Damon, Tom Sizemore",Won 5 Oscars. 79 wins & 75 nominations total,8.6,1480351,tt0120815,70000000 ,217049603,482349603,30576104
City of God,2004-02-13,"Crime, Drama",130,R,"Brazil, France, Germany",Portuguese,"Fernando Meirelles, Kátia Lund","Paulo Lins, Bráulio Mantovani","Alexandre Rodrigues, Leandro Firmino, Matheus Nachtergaele",Nominated for 4 Oscars. 75 wins & 50 nominations total,8.6,794637,tt0317248,R3300000 ,7564459,30680793,88292
Life Is Beautiful,1997-12-20,"Comedy, Drama, Romance",116,PG-13,Italy,"Italian, German, English",Roberto Benigni,"Vincenzo Cerami, Roberto Benigni","Roberto Benigni, Nicoletta Braschi, Giorgio Cantarini",Won 3 Oscars. 72 wins & 52 nominations total,8.6,735014,tt0118799,20000000 ,57563264,230099013,118920
The Green Mile,1999-12-10,"Crime, Drama, Fantasy",189,R,United States,"English, French",Frank Darabont,"Stephen King, Frank Darabont","Tom Hanks, Michael Clarke Duncan, David Morse",Nominated for 4 Oscars. 15 wins & 37 nominations total,8.6,1390817,tt0120689,60000000 ,136801374,286801374,18017152
Terminator 2: Judgment Day,1991-07-03,"Action, Sci-Fi",137,R,United States,"English, Spanish",James Cameron,"James Cameron, William Wisher","Arnold Schwarzenegger, Linda Hamilton, Edward Furlong",Won 4 Oscars. 39 wins & 33 nominations total,8.6,1162149,tt0103064,102000000 ,205881154,520881154,31765506
Star Wars: Episode IV - A New Hope,1977-05-25,"Action, Adventure, Fantasy",121,PG,United States,English,George Lucas,George Lucas,"Mark Hamill, Harrison Ford, Carrie Fisher",Won 6 Oscars. 66 wins & 31 nominations total,8.6,1435882,tt0076759,11000000 ,460998507,775398007,1554475
Back to the Future,1985-07-03,"Adventure, Comedy, Sci-Fi",116,PG,United States,English,Robert Zemeckis,"Robert Zemeckis, Bob Gale","Michael J. Fox, Christopher Lloyd, Lea Thompson",Won 1 Oscar. 23 wins & 25 nominations total,8.5,1291396,tt0088763,19000000 ,214077472,384577472,11152500
Spirited Away,2003-03-28,"Animation, Adventure, Family",125,PG,Japan,Japanese,Hayao Miyazaki,Hayao Miyazaki,"Daveigh Chase, Suzanne Pleshette, Miyu Irino",Won 1 Oscar. 58 wins & 31 nominations total,8.6,835536,tt0245429,19000000 ,15205725,357287850,449839
Spider-Man: Across the Spider-Verse,2023-06-02,"Animation, Action, Adventure",140,PG,United States,English,"Joaquim Dos Santos, Kemp Powers, Justin K. Thompson","Phil Lord, Christopher Miller, Dave Callaham","Shameik Moore, Hailee Steinfeld, Brian Tyree Henry",Nominated for 1 Oscar. 69 wins & 168 nominations total,8.6,344248,tt9362722,150000000 ,381593754,690897910,120663589
The Pianist,2003-03-28,"Biography, Drama, Music",150,R,"France, Poland, Germany, United Kingdom, United States","English, German, Russian",Roman Polanski,"Ronald Harwood, Wladyslaw Szpilman","Adrien Brody, Thomas Kretschmann, Frank Finlay",Won 3 Oscars. 57 wins & 74 nominations total,8.5,898798,tt0253474,35000000 ,32585488,120085488,111261
Parasite,2019-11-08,"Drama, Thriller",132,R,South Korea,"Korean, English",Bong Joon Ho,"Bong Joon Ho, Han Jin-won","Song Kang-ho, Lee Sun-kyun, Cho Yeo-jeong",Won 4 Oscars. 309 wins & 265 nominations total,8.5,932313,tt6751668,11400000 ,53369749,262029080,393216
Psycho,1960-09-08,"Horror, Mystery, Thriller",109,R,United States,English,Alfred Hitchcock,"Joseph Stefano, Robert Bloch","Anthony Perkins, Janet Leigh, Vera Miles",Nominated for 4 Oscars. 8 wins & 14 nominations total,8.5,711694,tt0054215,806947 ,32000000,0,32052925
Gladiator,2000-05-05,"Action, Adventure, Drama",155,R,"United States, United Kingdom, Malta, Morocco",English,Ridley Scott,"David Franzoni, John Logan, William Nicholson","Russell Crowe, Joaquin Phoenix, Connie Nielsen",Won 5 Oscars. 60 wins & 104 nominations total,8.5,1599965,tt0172495,103000000 ,187705427,465380802,34819017
The Lion King,1994-06-24,"Animation, Adventure, Drama",88,G,United States,"English, Swahili, Xhosa, Zulu","Roger Allers, Rob Minkoff","Irene Mecchi, Jonathan Roberts, Linda Woolverton","Matthew Broderick, Jeremy Irons, James Earl Jones",Won 2 Oscars. 43 wins & 35 nominations total,8.5,1127781,tt0110357,45000000 ,422783777,968511805,1586753
Léon: The Professional,1994-11-18,"Action, Crime, Drama",110,R,"France, United States","English, Italian, French",Luc Besson,Luc Besson,"Jean Reno, Gary Oldman, Natalie Portman",5 wins & 16 nominations,8.5,1232937,tt0110413,19501238,5306558,0,19569225
The Departed,2006-10-06,"Crime, Drama, Thriller",151,R,"United States, Hong Kong","English, Cantonese",Martin Scorsese,"William Monahan, Alan Mak, Felix Chong","Leonardo DiCaprio, Matt Damon, Jack Nicholson",Won 4 Oscars. 98 wins & 141 nominations total,8.5,1408134,tt0407887,90000000 ,132399394,291480452,26887467
American History X,1998-11-20,"Crime, Drama",119,R,United States,English,Tony Kaye,David McKenna,"Edward Norton, Edward Furlong, Beverly D'Angelo",Nominated for 1 Oscar. 4 wins & 15 nominations total,8.5,1176245,tt0120586,20000000 ,6719864,23875127,156076
Whiplash,2014-10-15,"Drama, Music",106,R,United States,English,Damien Chazelle,Damien Chazelle,"Miles Teller, J.K. Simmons, Melissa Benoist",Won 3 Oscars. 98 wins & 144 nominations total,8.5,970021,tt2582802,3300000 ,13092000,49440474,135388
The Prestige,2006-10-20,"Drama, Mystery, Sci-Fi",130,PG-13,"United Kingdom, United States",English,Christopher Nolan,"Jonathan Nolan, Christopher Nolan, Christopher Priest","Christian Bale, Hugh Jackman, Scarlett Johansson",Nominated for 2 Oscars. 6 wins & 45 nominations total,8.5,1422479,tt0482571,0,0,0,0
Grave of the Fireflies,1989-07-26,"Animation, Drama, War",89,Not Rated,"Japan, United States","English, Japanese",Isao Takahata,"Akiyuki Nosaka, Isao Takahata","Tsutomu Tatsumi, Ayano Shiraishi, Akemi Yamaguchi",3 wins,8.5,304968,tt0095327,3700000 ,516962,516962,158101
Harakiri,1964-08-04,"Action, Drama, Mystery",133,Not Rated,Japan,Japanese,Masaki Kobayashi,"Yasuhiko Takiguchi, Shinobu Hashimoto","Tatsuya Nakadai, Akira Ishihama, Shima Iwashita",9 wins & 3 nominations,8.6,66516,tt0056058,15222,0,0,0
The Usual Suspects,1995-08-16,"Crime, Drama, Mystery",106,R,"United States, Germany","English, Hungarian, Spanish, French",Bryan Singer,Christopher McQuarrie,"Kevin Spacey, Gabriel Byrne, Chazz Palminteri",Won 2 Oscars. 37 wins & 17 nominations total,8.5,1136304,tt0114814,6000000 ,23341568,23341568,645363
Casablanca,1943-01-23,"Drama, Romance, War",102,PG,United States,"English, French, German, Italian, Russian",Michael Curtiz,"Julius J. Epstein, Philip G. Epstein, Howard Koch","Humphrey Bogart, Ingrid Bergman, Paul Henreid",Won 3 Oscars. 14 wins & 11 nominations total,8.5,600213,tt0034583,950000 ,4219709,4627326,181494
The Intouchables,2011-11-02,"Comedy, Drama",112,R,France,"French, English","Olivier Nakache, Éric Toledano","Olivier Nakache, Éric Toledano, Philippe Pozzo di Borgo","François Cluzet, Omar Sy, Anne Le Ny",Nominated for 1 BAFTA Award38 wins & 40 nominations total,8.5,918387,tt1675434,10198820,103507,0,426588510
Modern Times,1936-02-25,"Comedy, Drama, Romance",87,G,United States,English,Charles Chaplin,Charles Chaplin,"Charles Chaplin, Paulette Goddard, Henry Bergman",4 wins & 1 nomination,8.5,257290,tt0027977,1500000 ,163577,463618,35809
Cinema Paradiso,1990-02-23,"Drama, Romance",155,PG,"Italy, France",Italian,Giuseppe Tornatore,"Giuseppe Tornatore, Vanna Paoli","Philippe Noiret, Enzo Cannavale, Antonella Attili",Won 1 Oscar. 25 wins & 32 nominations total,8.5,279511,tt0095765,5000000 ,12397210,13019063,16552
Rear Window,1954-09-01,"Mystery, Thriller",112,PG,United States,English,Alfred Hitchcock,"John Michael Hayes, Cornell Woolrich","James Stewart, Grace Kelly, Wendell Corey",Nominated for 4 Oscars. 6 wins & 13 nominations total,8.5,516997,tt0047396,1000000 ,36764313,0,37034884
Once Upon a Time in the West,1969-07-04,Western,166,PG-13,"Italy, United States","Italian, English, Spanish",Sergio Leone,"Sergio Donati, Sergio Leone, Dario Argento","Henry Fonda, Charles Bronson, Claudia Cardinale",6 wins & 5 nominations,8.5,346647,tt0064116,5000000 ,5321508,0,5435312
12th Fail,2023-10-27,"Biography, Drama",147,N/A,India,"Hindi, Malayalam, Tamil, Telugu, Kannada",Vidhu Vinod Chopra,"Vidhu Vinod Chopra, Jaskunwar Kohli, Anurag Pathak","Vikrant Massey, Medha Shankar, Joshi Anantvijay",9 wins & 11 nominations,9.1,96262,tt23849204,0,0,138288,0
Alien,1979-06-22,"Horror, Sci-Fi",117,R,"United Kingdom, United States",English,Ridley Scott,"Dan O'Bannon, Ronald Shusett","Sigourney Weaver, Tom Skerritt, John Hurt",Won 1 Oscar. 18 wins & 22 nominations total,8.5,939605,tt0078748,11000000 ,81900459,106285522,3527881
City Lights,1931-03-07,"Comedy, Drama, Romance",87,G,United States,"None, English",Charles Chaplin,"Charles Chaplin, Harry Carr, Harry Crocker","Charles Chaplin, Virginia Cherrill, Florence Lee",4 wins,8.5,194282,tt0021749,1500000 ,19181,50419,9102
Apocalypse Now,1979-08-15,"Drama, Mystery, War",147,R,United States,"English, French, Vietnamese",Francis Ford Coppola,"John Milius, Francis Ford Coppola, Michael Herr","Martin Sheen, Marlon Brando, Robert Duvall",Won 2 Oscars. 21 wins & 33 nominations total,8.4,703558,tt0078788,31500000 ,96042913,104876307,118558
Django Unchained,2012-12-25,"Drama, Western",165,R,United States,"English, German, French, Italian",Quentin Tarantino,Quentin Tarantino,"Jamie Foxx, Christoph Waltz, Leonardo DiCaprio",Won 2 Oscars. 58 wins & 158 nominations total,8.5,1672172,tt1853728,100000000 ,162805434,426074373,30122888
Memento,2001-05-25,"Mystery, Thriller",113,R,United States,English,Christopher Nolan,"Christopher Nolan, Jonathan Nolan","Guy Pearce, Carrie-Anne Moss, Joe Pantoliano",Nominated for 2 Oscars. 57 wins & 59 nominations total,8.4,1309458,tt0209144,9000000 ,25544867,40047078,235488
WALL·E,2008-06-27,"Animation, Adventure, Family",98,G,"United States, Japan","English, Russian, Ukrainian",Andrew Stanton,"Andrew Stanton, Pete Docter, Jim Reardon","Ben Burtt, Elissa Knight, Jeff Garlin",Won 1 Oscar. 96 wins & 95 nominations total,8.4,1187738,tt0910970,180000000 ,223808164,521311890,63087526
Raiders of the Lost Ark,1981-06-12,"Action, Adventure",115,PG,United States,"English, German, Spanish, Nepali, Hebrew, Arabic",Steven Spielberg,"Lawrence Kasdan, George Lucas, Philip Kaufman","Harrison Ford, Karen Allen, Paul Freeman",Won 4 Oscars. 38 wins & 24 nominations total,8.4,1028786,tt0082971,18000000 ,248159971,389925971,8305823
The Lives of Others,2007-03-30,"Drama, Mystery, Thriller",137,R,"Germany, France",German,Florian Henckel von Donnersmarck,Florian Henckel von Donnersmarck,"Ulrich Mühe, Martina Gedeck, Sebastian Koch",Won 1 Oscar. 80 wins & 38 nominations total,8.4,406419,tt0405094,2000000 ,11286112,77356942,223000
Sunset Blvd.,1950-08-04,"Drama, Film-Noir",110,Passed,United States,English,Billy Wilder,"Charles Brackett, Billy Wilder, D.M. Marshman Jr.","William Holden, Gloria Swanson, Erich von Stroheim",Won 3 Oscars. 19 wins & 20 nominations total,8.4,234021,tt0043014,1752000 ,299645,300073,169067
Paths of Glory,1957-12-25,"Drama, War",88,Approved,United States,"English, German, Latin",Stanley Kubrick,"Stanley Kubrick, Calder Willingham, Jim Thompson","Kirk Douglas, Ralph Meeker, Adolphe Menjou",Nominated for 1 BAFTA Award5 wins & 3 nominations total,8.4,209887,tt0050825,935000 ,5252,0,0
Avengers: Infinity War,2018-04-27,"Action, Adventure, Sci-Fi",149,PG-13,"United States, Norway",English,"Anthony Russo, Joe Russo","Christopher Markus, Stephen McFeely, Stan Lee","Robert Downey Jr., Chris Hemsworth, Mark Ruffalo",Nominated for 1 Oscar. 46 wins & 80 nominations total,8.4,1185266,tt4154756,321000000 ,678815482,2052415039,257698183
Spider-Man: Into the Spider-Verse,2018-12-14,"Animation, Action, Adventure",117,PG,"Canada, United States","English, Spanish","Bob Persichetti, Peter Ramsey, Rodney Rothman","Phil Lord, Rodney Rothman","Shameik Moore, Jake Johnson, Hailee Steinfeld",Won 1 Oscar. 84 wins & 59 nominations total,8.4,659349,tt4633694,90000000 ,190241310,384298736,35363376
The Shining,1980-06-13,"Drama, Horror",146,R,"United Kingdom, United States",English,Stanley Kubrick,"Stephen King, Stanley Kubrick, Diane Johnson","Jack Nicholson, Shelley Duvall, Danny Lloyd",6 wins & 8 nominations,8.4,1092792,tt0081505,19000000 ,45634352,47328250,622337
Witness for the Prosecution,1958-02-06,"Crime, Drama, Mystery",116,Approved,United States,"English, German",Billy Wilder,"Agatha Christie, Billy Wilder, Harry Kurnitz","Tyrone Power, Marlene Dietrich, Charles Laughton",Nominated for 6 Oscars. 3 wins & 15 nominations total,8.4,135630,tt0051201,3000000 ,7693,0,0
The Great Dictator,1941-03-07,"Comedy, Drama, War",125,G,United States,"English, Esperanto, Latin",Charles Chaplin,Charles Chaplin,"Charles Chaplin, Paulette Goddard, Jack Oakie",Nominated for 5 Oscars. 7 wins & 6 nominations total,8.4,235571,tt0032553,2000000 ,970263,0,0
Aliens,1986-07-18,"Action, Adventure, Sci-Fi",137,R,"United Kingdom, United States","English, Spanish",James Cameron,"James Cameron, David Giler, Walter Hill","Sigourney Weaver, Michael Biehn, Carrie Henn",Won 2 Oscars. 20 wins & 25 nominations total,8.4,755647,tt0090605,18500000 ,85160248,131060248,10052042
Inglourious Basterds,2009-08-21,"Adventure, Drama, War",153,R,"Germany, United States","English, German, French, Italian",Quentin Tarantino,Quentin Tarantino,"Brad Pitt, Diane Kruger, Eli Roth",Won 1 Oscar. 134 wins & 172 nominations total,8.4,1561622,tt0361748,70000000 ,120540719,321457747,38054676
The Dark Knight Rises,2012-07-20,"Action, Drama, Thriller",164,PG-13,"United States, United Kingdom","English, Arabic",Christopher Nolan,"Jonathan Nolan, Christopher Nolan, David S. Goyer","Christian Bale, Tom Hardy, Anne Hathaway",Nominated for 1 BAFTA Award43 wins & 104 nominations total,8.4,1805388,tt1345836,250000000 ,448149584,1114085030,160887295
Dr. Strangelove or: How I Learned to Stop Worrying and Love the Bomb,1964-01-29,"Comedy, War",95,PG,"United Kingdom, United States","English, Russian",Stanley Kubrick,"Stanley Kubrick, Terry Southern, Peter George","Peter Sellers, George C. Scott, Sterling Hayden",Nominated for 4 Oscars. 14 wins & 11 nominations total,8.4,513884,tt0057012,1800000 ,9440272,9525941,11751
American Beauty,1999-10-01,Drama,122,R,United States,English,Sam Mendes,Alan Ball,"Kevin Spacey, Annette Bening, Thora Birch",Won 5 Oscars. 112 wins & 102 nominations total,8.3,1202201,tt0169547,15000000 ,130096601,356296601,861531
Oldboy,2003-11-21,"Action, Drama, Mystery",120,R,South Korea,Korean,Park Chan-wook,"Garon Tsuchiya, Nobuaki Minegishi, Park Chan-wook","Choi Min-sik, Yoo Ji-tae, Kang Hye-jeong",40 wins & 27 nominations,8.3,626661,tt0364569,3000000 ,2458200,17504823,68957
Coco,2017-11-22,"Animation, Adventure, Drama",105,PG,"United States, Mexico, Japan","English, Spanish","Lee Unkrich, Adrian Molina","Lee Unkrich, Jason Katz, Matthew Aldrich","Anthony Gonzalez, Gael García Bernal, Benjamin Bratt",Won 2 Oscars. 110 wins & 41 nominations total,8.4,578517,tt2380307,175000000 ,210460015,814337054,50802605
Amadeus,1984-09-19,"Biography, Drama, Music",160,PG,"United States, France","English, Italian, Latin, German, French",Milos Forman,"Peter Shaffer, Zdenek Mahler","F. Murray Abraham, Tom Hulce, Elizabeth Berridge",Won 8 Oscars. 43 wins & 15 nominations total,8.4,424321,tt0086879,18000000 ,51973029,52066791,505276
Toy Story,1995-11-22,"Animation, Adventure, Comedy",81,G,"United States, Japan","English, Russian, Ukrainian",John Lasseter,"John Lasseter, Pete Docter, Andrew Stanton","Tom Hanks, Tim Allen, Don Rickles",Nominated for 3 Oscars. 29 wins & 23 nominations total,8.3,1057356,tt0114709,30000000 ,223225679,394436586,29140617
The Boat,1982-02-10,"Drama, War",149,R,"West Germany, Italy, France, United Kingdom",German,Wolfgang Petersen,"Wolfgang Petersen, Lothar G. Buchheim","Jürgen Prochnow, Herbert Grönemeyer, Klaus Wennemann",Nominated for 6 Oscars. 13 wins & 12 nominations total,8.4,262394,tt0082096,11487676,26994,0,11487676
Braveheart,1995-05-24,"Biography, Drama, History",178,R,United States,"English, French, Latin, Gaelic, Italian",Mel Gibson,Randall Wallace,"Mel Gibson, Sophie Marceau, Patrick McGoohan",Won 5 Oscars. 34 wins & 34 nominations total,8.3,1082896,tt0112573,72000000 ,75609945,213216216,9938276
Avengers: Endgame,2019-04-26,"Action, Adventure, Drama",181,PG-13,United States,"English, Japanese, Xhosa, German","Anthony Russo, Joe Russo","Christopher Markus, Stephen McFeely, Stan Lee","Robert Downey Jr., Chris Evans, Mark Ruffalo",Nominated for 1 Oscar. 70 wins & 133 nominations total,8.4,1246637,tt4154796,356000000 ,858373000,2799439100,357115007
Joker,2019-10-04,"Crime, Drama, Thriller",122,R,"United States, Canada, Australia","English, German",Todd Phillips,"Todd Phillips, Scott Silver, Bob Kane","Joaquin Phoenix, Robert De Niro, Zazie Beetz",Won 2 Oscars. 121 wins & 245 nominations total,8.4,1450964,tt7286456,55000000 ,335477657,1078958282,96202337
Princess Mononoke,1997-12-19,"Animation, Action, Adventure",134,PG-13,Japan,Japanese,Hayao Miyazaki,"Hayao Miyazaki, Neil Gaiman","Yôji Matsuda, Yuriko Ishida, Yûko Tanaka",14 wins & 6 nominations,8.3,427257,tt0119698,4845631,144446,0,170140933
Good Will Hunting,1998-01-09,"Drama, Romance",126,R,United States,English,Gus Van Sant,"Matt Damon, Ben Affleck","Robin Williams, Matt Damon, Ben Affleck",Won 2 Oscars. 24 wins & 61 nominations total,8.3,1050573,tt0119217,10000000 ,138433435,225933435,272912
Oppenheimer,2023-07-21,"Biography, Drama, History",180,R,"United States, United Kingdom","English, German, Italian",Christopher Nolan,"Christopher Nolan, Kai Bird, Martin Sherwin","Cillian Murphy, Emily Blunt, Matt Damon",Nominated for 13 Oscars. 252 wins & 379 nominations total,8.4,621863,tt15398776,100000000 ,328980665,957552665,82455420
Your Name.,2017-04-07,"Animation, Drama, Fantasy",106,TV-PG,Japan,Japanese,Makoto Shinkai,"Makoto Shinkai, Clark Cheng","Ryunosuke Kamiki, Mone Kamishiraishi, Ryo Narita",17 wins & 27 nominations,8.4,311340,tt5311514,5017246,1813781,0,382238181
Once Upon a Time in America,1984-06-01,"Crime, Drama",229,R,"United States, Italy","English, Italian, French, Yiddish, Hebrew",Sergio Leone,"Harry Grey, Leonardo Benvenuti, Piero De Bernardi","Robert De Niro, James Woods, Elizabeth McGovern",Won 2 BAFTA 11 wins & 13 nominations total,8.3,374150,tt0087843,30000000 ,5321508,5474818,2412014
High and Low,1963-11-26,"Crime, Drama, Mystery",143,Not Rated,Japan,Japanese,Akira Kurosawa,"Hideo Oguni, Ryûzô Kikushima, Eijirô Hisaita","Toshirô Mifune, Yutaka Sada, Tatsuya Nakadai",3 wins & 3 nominations,8.4,51939,tt0057565,46808,15942,0,46808
